Title,Location,Company,Salary,Synopsis,Level,Experience,Date Posted
Content Writer,Dubai,"Global Pulse Confederation (Dubai, UAE)","1,100",A portfolio of articles written (business or agriculture journalism preferred). Ability to work with content editors and managers in submitting revisions or…,None,(),2021-03-16
Business Development Manager experienced in web & mobile ser...,Dubai,DA STUDIO,None,"Business development: 3 years (Required). The candidate must be hardworking, highly motivated with the desire to achieve high sales results.",None,3,2021-03-24
Production Supply Planner,Jebel Ali,National Oilwell Varco,None,"Able to define, work within and improve business processes based on immediate and future business needs. Good understanding of supply chain processes.",None,None,2021-04-08
"IFS - HC - Graduate Recruitment Manager - (UAE, KSA, Jordan,...",Dubai,PwC,None,Engage and train hiring managers to get support with the graduate recruiting process. Utilise the most appropriate forms of assessment within selection…,None,None,2021-04-07
BUSINESS DEVELOPMENT MANAGER,Dubai,Agile Consultants,None,"Quickly form positive and productive relationships with colleagues across the business and work closely with key stakeholders (e.g., Internal Sales Team,…",None,None,2021-04-08
Business Development Manager,Dubai,Migratio,None,"Create highly relevant sales opportunities * Generate new business opportunities by following proven processes to prospect into business accounts, identify and…",None,None,2021-03-18
Assistant Supply Chain Manager,Media City,Samsung Electronics,None,"As part of of the Supply Chain Management team, your role will be integral to supporting the business plan, implement and monitor our overall supply chain…",None,None,2021-03-12
Area Manager,Dubai,Al Shamsi Holdings,None,Responsible for smooth business operations and scheduling or planning of weekly Rota/ staff leaves in accordance with the policy as well as the business…,None,None,2021-03-12
Business Development Intern,Dubai,Amazon Middle East and NA FZ,None,Ability to innovate and simplify current processes and practices. High affinity towards data and technology with ability to dive deep and analyze opportunities…,None,None,2021-03-12
Workplace Manager,Dubai,Sprinklr,None,"Remove distractions to keep the workforce happy, productive and growing the business. Policy Maker: Design and implement office policies with Head of Facilities…",None,None,2021-03-27
QHSE & Security Manager,Dubai,John Crane,None,"Experience on closed loop quality solving processes and Root Cause Analysis (RCA). Report to management as appropriate on the progress of works, attend and…",None,None,2021-03-12
Manager Group Credit,Dubai,Emirates NBD,None,Interacting with business managers up to the level of Team Leaders and GMs. Set up Credit policies which allow us to process credit proposals from Wholesale (FI…,None,None,2021-04-07
Business Development Manager,Dubai,Brunel,None,The business development manager contributes to the Group strategy definition in the region (frequent feedback about business opportunities based on market…,None,None,2021-04-05
Business Setup Consultant,Dubai,DEDCafe,None,Display (and maintain) a high level of UAE business setup market knowledge with customers in order to be seen as ‘expert’ and a credible source of information…,None,None,2021-03-12
Marketing Director,Dubai,Aeon & Trisl,"10,000-18,000",Track campaigns performance against business’s over all goals and objectives. Provide weekly/monthly and annual forecasts for all business’s products evaluate…,None,6,2021-03-29
"Associate Manager, Customer Service and Supply Chain",Dubai,BIC,None,R - Overall Order Management process knowledge. Analyze business needs in terms of products and ensure their availability. Work closely with the Demand Planner.,None,None,2021-03-20
Customer Logistics Implant,Dubai,Kraft Heinz Company,None,"Process and streamline documentation flows through the business. Owner of clearance / documentation part of the business. In brief, you will be responsible to;",None,None,2021-03-25
HR Manager,Dubai,Babyshop Concept,None,"Facilitate the performance management process in the Concept. Support business initiatives to develop a performance driven, customer-oriented culture.",None,None,2021-03-12
"Manager, Design Management",Dubai,Majid Al Futtaim,None,Aligned outcomes & delivery of all projects with other business functions. Create the Design Brief & Deliver a Design outcome that aligns with and incorporates…,None,None,2021-04-01
Female business development manager required for Interior Fi...,Dubai,rectangleinterior.com,"4,000","Business development manager: 1 year (Preferred). Proven working experience as a business development manager, sales executive or a relevant role.",None,None,2021-04-05
Sr Program Manager,Dubai,Q-Express Documents Transport,None,Develop metrics and set up tools to measure operational performance as part of the business growth. Use lean techniques and methodologies to root cause process…,None,None,2021-04-07
Regional Sales Manager,Dubai,Infobip,None,"Create growth strategies, enhance processes, across assigned regions is implemented in line with company strategy.",None,None,2021-04-06
HR Business Partner,Dubai,Dentsu Aegis Network,None,"Lead and/or support business leaders in key organisational change management initiatives (M&A’s, organisational culture change, business process re-engineering,…",None,None,2021-03-12
Procurement Manager - TV & Film Production (Dubai based),None,The Portfolio Group,None,"Implement some procurement policies for the business to follow. Non-negotiable in terms of experience, you will have worked within the film/TV/Media industry,…",None,None,2021-04-07
Senior Operations Officer (UAE Nationals Only with Family Bo...,None,MDC Business Management Services,"30,000-35,000","Manage all resources and processes to ensure efficiency and optimization of resource capacity. Ensure teams are operating to prescribed standardized policies,…",Senior,3,2021-03-12
Business Development Manager (Female),Abu Dhabi,National Corporation for Tourism and Hotels,None,"The successful candidate must be Arabic speaking, with high level proficiency in English and have a proven sales track record. Job Types: Full-time, Permanent.",None,None,2021-04-11
Business Development Manager (Electronic Waste Recycling),Abu Dhabi,Rel-i Consultants UAE,None,"Business development in Abu Dhabi market: 3 years (Required). Develop and Implement the sales and operation process, best practices and lead the technical team.",None,3,2021-04-07
Manager IT,Abu Dhabi,Etihad Airways,None,Create and implement risk mitigation processes and support security & governance audits. Experience determining business and technical objectives to set…,None,None,2021-04-08
Business Center Manager,Abu Dhabi,"Hill International, Inc",None,"Cover any operating areas when and where required without affecting the business operations. Managing several business centres, meetings rooms & conferences…",None,None,2021-03-12
Customer Service Operations Manager,Abu Dhabi,Property Shop Investment,None,§ Keep Call Center informed and briefed on upcoming process changes. § Come up with new ideas with process improvement plans and prospects.,None,None,2021-04-05
Purchasing Manager (Warehouse/Supermarket/Groceries),Abu Dhabi,Al Ikhlas Gen Trading,"5,000-7,000",Working to improve purchasing systems and processes. Degree in business administration or a related field. Training new employees in the purchasing process and…,None,5,2021-03-12
Area Manager (Arabic Preferred),Abu Dhabi,Global Corp Group (Food & Beverages),"7,000-9,000","Make sure that all managers have a clear understanding of their Target and are in the same business objective and direction. Job Types: Full-time, Permanent.",None,5,2021-03-17
VP & HR Business Partner,Abu Dhabi,bankfab,None,Coach and support managers with performance management process to help them manage complex employee relations issues.,None,None,2021-04-08
Personal Assistant to Hotel Manager PRE-OPENING,Abu Dhabi,Curio Collection by Hilton,None,Assist the General Manager in recruitment process of expatriates and coordinate the application of related work visas and permits.,None,None,2021-04-04
HR Coordinator,Abu Dhabi,TWMA Middle East Ltd,"6,000-8,000","Administer HR support, guidance and implement requests received from employees and function manager/ supervisors, in line with established HR processes,…",None,3,2021-03-30
BUSINESS DEVELOPMENT,Abu Dhabi,ST Engineering,None,"Business development manager: 5 years (Preferred). Either Part-Time or Full-Time. Part-time hours: 48 per week. Job Types: Full-time, Part-time.",None,4,2021-04-08
Business Development Manager,Abu Dhabi,Hoxton Capital Management,None,Contacting new prospects via telephone to introduce the business and arrange an appointment. Maintaining a relationship with the prospect though-out the sales…,None,None,2021-03-12
Finance Manager PRE-OPENING,Abu Dhabi,Curio Collection by Hilton,None,"Relevant degree, in Finance or related business discipline, from an academic institution. Develop best practice financial accounting and control procedures and…",None,None,2021-04-04
Maintenance Support Manager,Abu Dhabi,Nawah Energy Company,None,"Assist in the development of the Division’s systems, processes and procedures, as well develop and implement the Department’s systems and processes, identifying…",None,None,2021-03-31
CENTER MANAGER,Abu Dhabi,FUTURE STUDY TRAINING & SKILLS DEVELOPMENT CENTER,"2,000-3,000","Establish, develop and maintain positive business and customer relationships. Sales Experience (Direct Sales and Tele Sales). Excellent knowledge of MS Office.",None,None,2021-03-30
Business Operations Associate,Abu Dhabi,Nathan & Nathan,None,"The role will encompass understanding all aspects of the company's business operations – and, while liaising with finance, project managers, strategy teams -…",None,None,2021-03-12
Business Development Manager (Coffee Roastery),Abu Dhabi,OilExec,None,"Coordinating daily store management operations • Overseeing stock levels and ordering supplies • Ensuring compliance with licensing, hygiene and health and…",None,None,2021-03-12
Senior Manager,Abu Dhabi,Apple,None,"Ability to collaborate with the store leadership team to develop strategic plans across multiple business groups, improving process and surpassing standards to…",Senior,None,2021-03-12
Business Excellence Manager,Abu Dhabi,Marc Ellis Consulting,None,Roll out use of suitable business excellence models. Roll out use of suitable business excellence models. Design an effective quality audit management system…,None,None,2021-03-12
Functional Business Analyst,Abu Dhabi,4th Wave,None,Re Analyzing business and Functional process in the bank and recommending best practices. Understanding the requirements and provide functional documents in…,None,None,2021-03-12
"Budget Officer, P-3",Abu Dhabi,International Renewable Energy Agency (IRENA),None,Expert knowledge of Enterprise Resources Planning (ERP) System processes and operations. Contributes significantly to the process of final biennial budget…,None,None,2021-04-11
Sales Manager,Abu Dhabi,Green Wood,"3,500-6,000",Builds business by identifying and selling prospects; maintaining relationships with clients. Identifies business opportunities by identifying prospects and…,None,None,2021-03-24
Customer Engagement Supervisor,Abu Dhabi,Property Shop Investment,None,Keep Call Center informed and briefed on upcoming process changes. Come up with new ideas with process improvement plans and prospects.,None,None,2021-04-05
"Shopkeeper - Markethall | IKEA | YAS Island, Abu Dhabi",Abu Dhabi,IKEA,None,Support the team to achieve their objectives by ensuring they understand the company business plan and objectives. Good Understanding of Business & Finance.,None,None,2021-03-30
"Manager, External Communication",Abu Dhabi,Taqa,None,"Collaborate with all business partners (Human Capital, Finance, Supply Chain, IT and Legal) to co-deliver defined key performance indicators (KPIs) in line with…",None,None,2021-04-01
System Installation Manager - Dubai and Fujairah,Abu Dhabi,Jacobs,None,"You MUST have experience in Signaling, telecommunications, asset protection systems, power supply systems, SCADA and operation control systems on working on…",None,None,2021-04-04
"Deputy Sales Manager | IKEA | YAS Island, Abu Dhabi",Abu Dhabi,IKEA,None,"Develop and implement commercial strategic plans based on business priorities and local market. 3 – 5 years in Home Furnishings business in a managerial role,…",None,None,2021-03-31
Office Administrator,Abu Dhabi,MYB Advanced Technology Systems,None,"Post and process journal entries to ensure all business transactions are recorded. Also, the candidate must have some understanding in accounting to provide…",None,,2021-03-12
Hospital Catering Food & Beverage Operations Manager,Abu Dhabi,AFOCH,None,"Enhance the operational procedure, systems and principles in the areas of information flow and management, business processes, enhanced management reporting and…",None,None,2021-03-23
Graphic Design Manager | IKEA | YAS Island - Abu Dhabi,Abu Dhabi,IKEA,None,"Plan, implement and follow up all projects in the store based on work briefs developed by Sales Managers and Com& In manager.",None,None,2021-04-07
Training Manager,Abu Dhabi,AAR Corp.,None,"Coordinate training as a part of the new hire/orientation process. Maintaining the processes for identify training needs for all technical personnel, both…",None,None,2021-03-12
Design Manager - Mid Level,Abu Dhabi,Gensler,None,Experience with the entire project lifecycle and design process through post-occupancy. Understanding of real-time rendering processes within the context of BIM…,None,None,2021-03-16
Accounting Intern,Abu Dhabi,Alpin Limited,None,Post and process journal entries to ensure all business transactions are recorded; Update accounts receivable and issue invoices; UAE driving license and car;,None,None,2021-03-12
Account Manager,Abu Dhabi,ABB,None,"Proven work experience as an account manager, key account manager, sales account manager, junior account manager or relevant role.",None,None,2021-04-07
Sales Associate - Tommy,Abu Dhabi,The Apparel Group,None,Perform various operational duties such as store maintenance and visual presentation standards as assigned by the store manager / assistant store manager.,None,None,2021-03-12
Business Analyst,Abu Dhabi,Al Masaood,None,"May act as a project manager in specific business initiatives, if required. Analyses primary and secondary market research studies, supporting the business…",None,None,2021-03-12
Restaurant Manager,Abu Dhabi,Excelsior Group,"10,000-15,000",Restaurant manager / assistant manager: 2 years (Required). Education: Preferred Bachelor in Hotel Management. O Retail Selling Experience preferred.,None,/2,2021-04-01
HR Consultant,Abu Dhabi,Int'l Human Resources Certification Programs. (Ihr...,"25,000","Proven record of successful business development. In addition, you will be contributing to business development: identifying opportunities for expansion and…",None,None,2021-03-21
Estimator and Proposal Pricing Manager,Abu Dhabi,Parsons International,None,To assist in developing and estimating business processes that will ensure applicability at the project level.,None,None,2021-04-07
Senior Manager Short Term Scheduling,Abu Dhabi,Etihad Airways,None,Full P&L responsibility for Etihad’s ad-hoc charter business with the objective to further increase the contribution coming from this business stream.,Senior,None,2021-04-07
Test and Commissioning Manager - Dubai and Fujairah,Abu Dhabi,Jacobs,None,"MUST have experience in Signaling, telecommunications, asset protection systems, power supply systems, SCADA and operation control systems on working on Brown…",None,None,2021-04-03
Information Technology Manager - UAE National,Abu Dhabi,ParkerConnect,None,"Ensures the establishment of adequate processes for evaluation of IT Hardware / Software vendors. To plan, manage and control all the activities of the IT…",None,None,2021-04-06
Assistant Supply Chain Manager (Medical Devices),Abu Dhabi,Middle East Executive,None,"It is the incumbent’s responsibility to ensure the absolute accuracy of work flow process, in an efficient and timely manner.",None,None,2021-03-12
Operations Manager,Abu Dhabi,Alpin Limited,None,"Monitor, control and manage business operations to meet client expectations and company goals; Identify problems in the operations process and resolve them in a…",None,None,2021-03-12
Help Desk Support for Facilities Management,Abu Dhabi,United Al Saqer Group,None,Work closely with Contract/Facilities Managers to develop and enhance the quality of service and reporting processes.,None,None,2021-03-12
Facility Manager,Abu Dhabi,Delma Medical Center,None,Ensures the operation of appropriate project and business development activities in accordance with the organizational policies.,None,None,2021-03-12
Operations Manager (Gas Turbine) - Abu Dhabi,Abu Dhabi,OnePoint,None,Responsible for setting (planning) priorities in collaboration with contract managers and other department managers and advices the executive management on…,None,None,2021-03-12
Strategic Business Consultant (Project Specific Consultant),Abu Dhabi,Alpin Limited,None,Define a streamlined process of business engagement with customers that can ensure efficiency in liaison with externals; Minimum 5 years local experience.,None,None,2021-03-12
Technical Business Analyst,Abu Dhabi,4th Wave,None,Re Analyzing business and technical process in the bank and recommending best practices. Implementation and support of Applications.,None,None,2021-03-12
Talent Supply Demand Associate Manager,Abu Dhabi,Accenture,None,Involved in new business/client leadership meetings. Responsible for effective service delivery of all client supply and demand related processes.,None,None,2021-03-25
Senior Design Manager,Abu Dhabi,GHD,None,"You will be part of a dynamic multi-skilled project delivery organization with project managers, design managers and construction managers operating as a…",Senior,None,2021-03-28
New Venture and Special Projects Senior Manager,Abu Dhabi,MPH Global Services,None,"Develop and maintain strong relationships with strategic partners and all relevant external/internal entities with highest standards of business ethics, in…",Senior,None,2021-03-31
Business Development Manager Freezone,Abu Dhabi,Mark Williams,None,"Recommend process improvements to enhance client experience, by simplifying and streamlining all internal end to end client management and operation processes,…",None,None,2021-03-23
Strategy& Middle East - Manager,Abu Dhabi,Strategy&,None,"Developing and identifying new business opportunities as they present themselves. Between 7 to 10 years of professional experience, gained in a top strategy…",None,None,2021-03-12
Marketing & Relationship Manager (PRE-OPENING),Abu Dhabi,Curio Collection by Hilton,None,"Drive the development of a sound B2B and B2C strategy by segment for the hotel, in line with the commercial focus process.",None,None,2021-03-25
Building Facilities Manager,Abu Dhabi,SUNDUS RECRUITMENT & OUTSOURCING SERVICES LLC,None,Building Facilities processes /forms Automation. Carry out fire drills as required by the business. Approve MOB repairs in accordance with prescribed process &…,None,None,2021-03-12
Security Specialist,Abu Dhabi,"Hill International, Inc",None,"Responsible for carrying out Strategic Security Planning aligned with organization’s priorities and strategic targets, develop security process and procedures…",None,None,2021-04-08
Specialist-Problem Management,Abu Dhabi,Digital14,None,Take ownership for major incident handling process to support 24/7 support. Directly or indirectly participate in the preparation and improvement of the Problem…,None,None,2021-04-11
Deputy Sales Manager,Abu Dhabi,Al-Futtaim,None,"Develop and implement commercial strategic plans based on business priorities and local market. Al-Futtaim IKEA holds the franchise rights for IKEA in Egypt,…",None,None,2021-03-31
Scrum Master,Abu Dhabi,IRISSTAR Technologies,None,Facilitate Retrospectives which generate new ideas for process improvement. Promote and support the Development Team’s automated processes.,None,4,2021-04-08
Territory Sales Manager,Mussafah,Schneider Electric,None,"Degree is essential, preferably in Engineering or a business discipline. A Sales manager is responsible for identifying, developing, and expanding relationships…",None,None,2021-03-28
Project Manager - Defense Project / Contractor,Abu Dhabi,eMagine Solutions,None,Our client with multiple service lines are looking for Project Manager within their Defense equipment business.,None,None,2021-03-17
"Sales Manager–Security, ICT & Audio Visual Systems",Abu Dhabi,NAFFCO,None,Maintain awareness of development in sales process and product development. Identify new potential customers within the allocated geographical area and…,None,None,2021-04-07
Claims Executive,Abu Dhabi,Willis Towers Watson,None,Communicate with various personnel regarding the ongoing claim process and assist field personnel with any follow-up issues.,None,None,2021-03-12
Tender Analyst,Abu Dhabi,AFOCH,None,"Establish processes to execute and deliver a completed qualifying technical submission. The bid manager should execute the role strategically, and yet be able…",None,None,2021-03-29
Service Delivery manager (IT Division),Abu Dhabi,SUNDUS RECRUITMENT & OUTSOURCING SERVICES LLC,None,"Understanding the customers business and their business requirements. Analysing security trends, business risks and areas of improvement or opportunities.",None,None,2021-03-12
Digital Project Manager - Siemens Advanta,Abu Dhabi,Siemens Industrial LLC,None,"Outstanding university degree or top business school MBA, ideally in business, engineering, natural science, or IT from a globally renowned university.",None,None,2021-03-22
Vice President – Business Planning and Investment Analysis,Abu Dhabi,Aldar,None,As a member of the Corporate Finance team you will play an integral role in providing financial analysis support that enables the leadership to make business…,None,None,2021-03-12
Senior BIM Manager,Abu Dhabi,iTech Management Consultancy and Training LLC,None,"Identify new business opportunities within existing clients (project extension, new requirements, consulting services, etc.).",Senior,None,2021-03-12
MR Modality Sales Manager,Abu Dhabi,GE Healthcare,None,"Strong analytical and process skills, strong project management skills. Provide input to and contribute to the formulation of the yearly business planning…",None,None,2021-04-01
Executive Assistant,Abu Dhabi,Group 42,None,"The primary purpose of the role is to provide administration, Analysis, reporting and coordination support, including inbox and diary management, meeting and…",None,None,2021-03-12
Contract Manager VESE - EGA,Abu Dhabi,Veolia,None,Ability to use logical and creative thought processes to develop solutions according to written specifications and/or oral instructions. Arabic would be a plus.,None,None,2021-03-12
Deputy Manager - Health & Benefits,Abu Dhabi,Willis Towers Watson,None,Minimum bachelor's degree in insurance/Marketing/business - it should be attested by the Ministry of Education/MOFA to be accepted by the Insurance Authority.,None,None,2021-03-12
Restaurant Manager,Abu Dhabi,Nolus Restaurant LLC Group,None,"Developing a business network of vendors. Restaurant manager responsibilities include maintaining the restaurant’s revenue, profitability and quality goals.",None,5,2021-03-22
Operations & Development Manager,Abu Dhabi,Yemnak,None,"To actively lead the research process, identify areas for change and manage such change together with the implementation of an on going monitoring process.",None,None,2021-03-12
Senior Automated QA,Abu Dhabi,Alef Education,None,Liaise with internal teams (e.g. developers and product managers) to identify system requirements. Develop and apply testing processes for new and existing…,Senior,None,2021-04-09
Cluster Social Media Manager,Abu Dhabi,Anantara,None,"Maintain accurate management status reporting on business results, and associated action planning. Ensure the website content is up to date for all hotels…",None,None,2021-03-31
Business Support Executive,Al-Ayn,The Rekruiters,"7,000",Thorough understanding of diverse business processes and strategy development. Proven experience as business executive or relevant role.,None,2,2021-03-12
Mechanical Maintenance Supervisor,Abu Dhabi,Nawah Energy Company,None,Execute technical review of maintenance process and procedure changes to ensure alignment to regulatory and industry best practices.,None,None,2021-03-31
Design Manager (6 Month Fixed Term Contract),Abu Dhabi,AECOM,None,+ Establish procedures and processes to assist in the briefing and information gathering process such as a Request for Information (RFI) system.,None,None,2021-03-23
Finance Manager,Abu Dhabi,SUNDUS RECRUITMENT & OUTSOURCING SERVICES LLC,None,"Graduate degree in economics, accounting, finance, business administration or equivalent. Contributing actively to the improvement of the processes and…",None,None,2021-03-12
Deputy Branch Manager,Abu Dhabi,Willis Towers Watson,None,Adherence of self and team to all compliance and business processes including WEM. Review of renewal business for adequacy of coverage and competitive rates.,None,None,2021-03-12
Engineering Manager ﻿,Abu Dhabi,Saab Inc.,None,Good knowledge in engineering and line management processes and standards. Another strong merit is knowledge about Saab existing processes and methodology in…,None,None,2021-03-12
