Title,Location,Company,Salary,Synopsis,Level,Experience,Date Posted
Assistant Technician - Chillers & Plants (Electrical),Dubai,Serco Plc,None,Any other work as assigned by the electrical supervisor/duty engineer to achieve the purpose. Secures and compares information from multiple sources and…,None,None,2021-03-18
Senior Consulting Engineer (EMEA),Dubai,MongoDB,None,"Work as part of a wider delivery team comprising fellow consulting engineers, project managers, and account teams. And MongoDB is at the head of its disruption.",Senior,None,2021-02-19
Information Management Manager,Dubai,Wood Plc,None,The position is responsible for lifecycle data management in support of Project Managers and Project Engineers. Audit and maintain performance to agreed SLA’s.,None,None,2021-03-09
Lighting Sales Support,Al Barsha,Ergo lighting Trading,"4,000","Understand and Analyse project specifications, BOQs, product selection, estimations, technical data. Candidates must be an Electrical Engineer, eager to work…",None,,2021-02-19
On-Site Technician,Dubai,Parsons,None,"Document results of data collection exercises such as traffic counts, travel times, queue data, etc. during peak and/or off-peak hours of weekdays.",None,None,2021-02-19
Software Engineer II - Android,Dubai,Talabat,None,"Knowledge of OOP, design patterns, data structures, and testing strategies. As part of the Delivery Hero network, Talabat is the pioneer of the online food…",None,None,2021-03-09
GIS Software Engineer,Dubai,Space Imaging Middle East,None,"Experience with GIS data and applications. As a GIS Software Engineer, you will participate in the design, architecture, development and maintenance of large…",None,None,2021-02-19
Data Engineer Royalties & Reporting,Abu Dhabi,Anghami,None,"Improve data quality and data models. Work with other data engineers, software engineers, decision-makers and business stakeholders such as product managers,…",None,None,2021-03-19
Site Engineer,Abu Dhabi,Golden Line Gypsum Works,None,Provides data in respect of variation orders and the site instructions. Prepares the time schedule and plan prior to start of the project.,None,None,2021-03-17
Data Engineer,Abu Dhabi,Al Madina Agencies And Services,None,Implement data models and structure data in ready-for consumption formats. Develop data and information structure. 5+ experience with Data Analysis.,None,None,2021-03-18
Data Engineer,Abu Dhabi,Schlumberger,None,"The Data Engineer will be responsible for designing and executing undirected research and tackling open-ended data problems related to AI, ML, predictive /…",None,None,2021-03-12
Process Safety Engineer,Abu Dhabi,Enerflex,None,"Assist with data collection for Quantitative Assessment (QRA) tools. Perform various functions, work collectively and collaboratively with other project…",None,None,2021-03-15
ENGINEER - AVIATION,Abu Dhabi,GAL,None,"Other technical report and determinate root cause, gather and analyze data and implement corrective action to reduce or eliminate cause.",None,None,2021-03-21
CIVIL ENGINEER,Abu Dhabi,Al Ghazi,None,"Hiring a Civil Engineer for Abu Dhabi. Maintains project database by writing computer programs, entering data, and completing backups.",None,None,2021-03-15
Construction Site Engineer,Abu Dhabi,Supportive Solutions Administrative Consultancies,None,"Gathering data, compiling reports and delivering presentations to relevant stakeholders. Organizing materials and ensuring sites are safe and clean.",None,None,2021-03-15
ELECTRICAL ENGINEER,Abu Dhabi,Al Ghazi,None,"Hiring an Electrical Engineer for Abu Dhabi. Four to six years experience as Electrical Engineer. Conferring with customers, engineers, and others to discuss…",None,None,2021-03-11
Sales Engineer,Abu Dhabi,Bin Moosa & Daly Ltd. LLC.,"7,000-10,000",Prepare quotations based on technical data and specifications. Visit consultants/clients on a regular basis and list/register Moosa-Daly’s products with all…,None,,2021-02-28
QA Engineer,Abu Dhabi,Weatherford,None,"10+ years in data management and material testing or manufacturing. Data management of the PO, Review on MTR and OC to be uploaded in Accorde system.",None,None,2021-03-08
Infrastructure Support Engineer,Abu Dhabi,Beacon Red,None,Experience in DATA PROTECTION – Backup & Storage. Installing and maintaining operating environments. Responding effectively and speedily to any problems.,None,None,2021-03-18
Data Centre Engineer,Abu Dhabi,Oracle,None,"Are you an experienced Data Centre Technician that has experience in data centre design/operation, racking, stacking , hardware break fix and everything in…",None,None,2021-02-25
Environmental Engineer,Abu Dhabi,Green wood,"3,000-5,000",Utilise your communication skills to relate scientific data into layman's terms. Before you begin advising clients on what they need to do to improve their…,None,10,2021-02-25
Site Engineer - Construction,Abu Dhabi,United Al Saqer Group,None,Supervising and counselling junior or trainee engineers. Liaising with the project planning engineer regarding construction programs.,None,None,2021-02-19
Supply Chain Specialist,Abu Dhabi,Raytheon Missiles & Defense,None,"Data analysis and metrics development. By the numbers alone, we are one of the world's largest aerospace and defense companies, with 195,000 employees, 60,000…",None,None,2021-03-19
Civil Structural Engineer,Abu Dhabi,Rejlers Finland & Abu Dhabi (UAE),None,The Civil Structural Engineer reports to the appointed manager. We are now looking for Civil Structural Engineer to execute projects and support bids in Abu…,None,None,2021-03-04
Commissioning Engineer,Abu Dhabi,Alpin Limited,None,"Maintain detailed and accurate project records including data, documentation, and progress reports. Monitor HVAC systems with building automation systems and…",None,None,2021-02-19
Machine Learning Engineer,Abu Dhabi,Anghami,None,"Knowledge about distributed & big data systems: 3+ years Experience with computer science fundamentals in object-oriented design, data structures, algorithm…",None,None,2021-03-18
Land Surveyor,Abu Dhabi,Parsons International,None,"Knowledge and/or experience in using CAD software and survey software, total station, data collectors and GPS equipment. Measure work done when required.",None,None,2021-03-19
Registration Engineer,Abu Dhabi,AL DHAFRA ELECTROMECHANIC L.L.C,"3,000",Provide regular and accurate data to senior managers regarding applications caseload management. Assess and process applications for registration accurately and…,None,None,2021-03-11
Data Science Specialist,Abu Dhabi,Serco Plc,None,"You will join a team of data specialists, but will “slice and dice” data using your own methods, creating new visions for the future.",None,None,2021-03-07
OCI DC Engineer,Abu Dhabi,Oracle,None,"Data Center Technician – Job Description. Data Center Experience is a MUST. 2-4 years experience in a data center environment and/or Associates degree in IT,.",None,None,2021-03-16
PCB Engineer,Abu Dhabi,Mondialab Limited,None,"Support firmware engineers with optimal hardware designs. Generates, verifies and validates Gerber data of PCB design. Experience in Digital and Analog design.",None,,2021-03-15
Systems Engineer - Gulf,Abu Dhabi,Palo Alto Networks,None,"As a Systems Engineer, you’ll enable sales engagements into a set of large new enterprise accounts. As a member of our systems engineer team, you are driven by…",None,None,2021-03-09
Accountant,Abu Dhabi,Architectural & Engineering Consultants,"5,000",Reinforce financial data confidentiality and conduct database backups when necessary. We are consulting engineers firm bases in Abu Dhabi and urgebtly looking…,None,None,2021-03-02
Architectural CAD Technician/ Draftsman,Abu Dhabi,Don Rite Project Management,None,"Coordinate with the Architect, Project Manager, Site Manager and Engineer to produce Shop Drawings and process Submittals.",Architect,1,2021-03-16
Unix System Engineer,Al-Ayn,United Arab Emirates University,None,"Responsible for data Backup and Recovery and servers Disaster Recovery. In support of change management within the data center, provides the CSC with high…",None,None,2021-02-19
Executive Assistant,Abu Dhabi,Group 42,None,"Experienced team of data scientists and engineers based in Abu Dhabi. Fundamental AI research, through our subsidiary the Inception Institute of Artificial…",None,None,2021-02-19
Software Engineer,None,"Confidential Company, Abu Dhabi",None,Cooperates with System Engineers to guarantee best services during exercises. The Software Engineer is a technology professional who has the necessary skills to…,None,,2021-02-19
Network Security Engineer,Abu Dhabi,IRISSTAR Technologies,"8,000-11,000","Collaborate with business groups to help them identify, classify, and secure high value data. Setup, configure, administer & maintain Palo Alto perimeter…",None,None,2021-02-19
IT Desktop Support Engineer,Abu Dhabi,Axiom Technologies,None,Weighs up options using the available data. Relates and compares data from different sources. Seeks out and uses factual data when available.,None,None,2021-03-04
Big Data Engineer,Abu Dhabi,Alef Education,None,"As an ALEF Big Data Engineer you'll have strong understanding of big data technologies with an exceptional ability to code. Abu Dhabi, United Arab Emirates.",None,None,2021-02-19
Senior Network Engineer - ENEC,Abu Dhabi,Nawah Energy Company,None,"To install, configure, maintain, support, and secure systems within Data Centre and local/wide area networks, including. 7 years of relevant experience.",Senior,None,2021-03-03
MEP Estimator (HVAC),Abu Dhabi,SAKA Group of Companies,"5,000-6,000","Meet the required sales targets, relevant KPIs and update CRM data in the system. With a strong technical background, the Sales Engineer would be accountable…",None,None,2021-03-08
Mechanical Engineer,Abu Dhabi,"BB&E, Inc.",None,"Mechanical Engineer – Al Dhafra AB, Abu Dhabi, UAE. Collect data and compile it into files compatible with the supported location.",None,None,2021-02-19
Sales Engineer,Abu Dhabi,Varonis,None,Identifies data relationships and dependencies; Uses intuition and experience to complement data. Ability to articulate the importance of Data Governance and…,None,None,2021-02-23
Siebel Software Engineer,Abu Dhabi,IRESCO,"2,391-10,433","Hands on experience on Siebel configuration (UI Layer, BO Layer and Data object layer). Post graduate in Computer Science or related field (or equivalent…",None,None,2021-03-08
General Manager - Abu Dhabi,Abu Dhabi,National Oilwell Varco,None,"Your team will gather data, turn it into usable information to focus our efforts, and then implement quantifiable improvements. This position reports to the Sr.",None,None,2021-02-28
Senior Engineer - Desalination,Abu Dhabi,Mott MacDonald,None,"Capability to develop a bespoke concept design for a new plant based on specific input data. Key responsibilities and duties are listed, but not limited to, the…",Senior,None,2021-02-19
Geotechnical Engineer,Abu Dhabi,Stantec,None,"Analyze geotechnical findings, perform appropriate calculations, and prepare data reports to be shared with project management. 7-10 years of work experience.",None,None,2021-02-19
Marine Draftsman,Abu Dhabi,Global Waters,"3,000","Carry out Site visits for inspection and data collections. Meet with architects, designers, and engineers to discuss design concepts.",None,None,2021-02-22
"Sr. Design Engineer, Electrical",Abu Dhabi,Rejlers Finland & Abu Dhabi (UAE),None,"Design Engineer, Electrical reports to the appointed manager. Ensure verification of source data, concept drawings/concepts as required. Do you want to join us?",Senior,None,2021-03-04
Maintenance Contract Administrator & Project Coordinator,Mussafah,Schneider Electric,None,"Providing direct administrative support to CS Engineer. Discuss with IBM Manager and plan the Engineer depends on the job nature. Mar 30, 2021, 11:59:00 PM.",None,None,2021-03-04
System Engineer,Al-Ayn,United Arab Emirates University,None,"Experience in designing complex virtual infrastructure solutions in a mid-to-large scale data center. In support of change management within the data center,…",None,None,2021-02-19
Engineering Advisor,Abu Dhabi,Nawah Energy Company,None,"Provide guidance, coaching/ mentoring, and training of other engineering staff across the engineering divisions to foster broader perspectives among less…",None,None,2021-02-19
CNC Operator,Mussafah,United Al Saqer Group,None,"Confers with engineers, production personnel, programmers, or others to resolve machining or assembly problems. Fluent in speaking English & Arabic.",None,None,2021-03-19
Network Engineer,Al-Ayn,United Arab Emirates University,None,"Analyzes complex data, voice or video network documentation and communicates to senior management regarding the current operational status of networks.",None,None,2021-02-19
Sales Engineer,Abu Dhabi,Aber Data Systems,"3,000-5,000","Need the UAE experience in (CCTV, Access control, Structured Cabling system , PA/VA Systems , AV System etc..)ELV system sales and marketing.",None,,2021-02-19
Junior Geotechnical Engineer,Abu Dhabi,Fugro,None,"The position of Junior Geotechnical Engineer sets an example to other engineers in the field. Liaise with geophysicists, work closely on geophysical and…",Junior,None,2021-02-19
Quality Control Engineer,Abu Dhabi,Sahil Green Line Human Resource Consultancy,None,To input data related to weld inspection. One of the Facilities Management company is looking for Quality Control_ Engineer_ on the urgent basis.,None,6,2021-03-10
Sr/Test Engineer (UAT),Abu Dhabi,SUNDUS RECRUITMENT & OUTSOURCING SERVICES LLC,None,"Requirement Understanding, Test Scenario Designing, Test Data Creation, Test Case Execution, Defect Management, Business UAT Support, Requirement Understanding,…",None,None,2021-02-19
Production Engineer,Abu Dhabi,IDCMPS,None," Reviews & comments at engineering packages for Major works comprising scope of work, data sheets, schedules, load lists, technical proposals, engineering…",None,None,2021-02-19
Outdoor Sales Engineer,Abu Dhabi,Eurosys,None,"Computer proficiency and the ability to accurately enter data and generate reports. Willingness and ability to travel 10% to 70% of the time, depending on the…",None,None,2021-02-19
Quality Assurance Automation Engineer,Abu Dhabi,7G Software Solutions,None,"Experience in Automation Selenium and Appium, Knowledge of Automation frameworks (Keyword/ Data/ Hybrid /BDD).",None,None,2021-03-05
Aircraft Quality Inspector,Abu Dhabi,AAR Corp.,None,Must be able to gather information and use data to determine cause and effect for complex problem solving. Inspects aircraft and components to ensure product…,None,None,2021-02-19
DevOps Engineer,Abu Dhabi,BeamTrail,None,"5+ years’ experience as DevOps engineer. We are looking for a DevOps Engineer to join our growing team in Abu Dhabi, UAE. In Computer Science or equivalent.",None,None,2021-03-11
CNC Operator (Woodworks),Mussafah,United Al Saqer Group,None,"Confers with engineers, production personnel, programmers, or others to resolve machining or assembly problems. Fluent in speaking English & Arabic.",None,None,2021-03-19
Senior FPGA Engineer,Abu Dhabi,BeamTrail,None,"We are looking for an experienced and motivated Senior FPGA Engineer to join our team in Abu Dhabi, UAE. BeamTrail works towards delivering the best solutions…",Senior,None,2021-03-11
.NET Developer/Programmer,Abu Dhabi,Independent Health Information Technology Services,None,"This position reports to the Senior Software Engineer. Strong experience designing and working with n-tier architectures (UI, Business Logic Layer, Data Access…",None,None,2021-02-19
"Automation Testing Engineer/QA (Python, Robot Framework)",Abu Dhabi,BeamTrail,None,"We are looking for an experienced Automation Testing Engineer to join our team in Abu Dhabi, UAE. BeamTrail works towards delivering the best solutions and user…",None,None,2021-03-11
Nurse,Abu Dhabi,Group 42,None,"Experienced team of data scientists and engineers based in Abu Dhabi. Fundamental AI research, through our subsidiary the Inception Institute of Artificial…",None,None,2021-03-18
Senior Asset Management Engineer,Abu Dhabi,Parsons,None,"Supporting implementation of these asset management activities including guiding inspections, asset inventory activities, asset data analysis, and asset…",Senior,None,2021-02-23
Urban Designer,Abu Dhabi,Stantec,None," Identify existing facilities and infrastructure on site, and characterize relevant environmental data. Our work as architects, engineers, and consultants from…",None,None,2021-02-19
Senior Data Scientist - Healthcare,Abu Dhabi,Black Pearl Consult,None,Collaborate with a cross-functional team including Data Scientists and Software Engineers. Or MS degree with industry experience as a Data Scientist.,Senior,None,2021-03-21
Senior Strategy and Performance Management Specialist,Abu Dhabi,Nawah Energy Company,None,"Continuously develop expertise in the data and data models within the data warehouse, as well as an understanding of supported business domains.",Senior,None,2021-02-19
Design Manager,Abu Dhabi,AECOM,None,"+ Manage project data exchange websites where necessary. + Manages the assigned team of Architects, Engineers and Technicians on a day to day basis and ensures…",None,None,2021-02-19
Sales Manager - Reverse Engineering,Abu Dhabi,SPX FLOW,None,"Coordinate with Field Service Engineers to win Customer maintenance contracts. Analyze the requirements in line with data sheets, specifications, P&IDs, plans,…",None,None,2021-02-19
Principal Project Control Specialist,Abu Dhabi,Worley,None,"Take ownership of the cost control function and ensure integrity of the data being processed, coordinate with Finance if required. Find your future with Worley.",None,None,2021-03-08
"Sr. Design Engineer, Instrumentation and Automation",Abu Dhabi,Rejlers Finland & Abu Dhabi (UAE),None,"Design Engineer, Instrumentation and Automation reports to Line Manager, EIA. Ensure verification of source data, concept drawings / concepts as required.",Senior,None,2021-03-04
Research Engineer under Center for Cyber Security - Prof. Na...,Abu Dhabi,New York University,None,"In Computer Science, Data Science or quantitative social sciences. Data science, machine learning, building and evaluating prototypes of novel solutions, online…",None,None,2021-02-19
C/C++ Software Engineer (Linux & Modern Principles),Abu Dhabi,BeamTrail,None,"We are looking for an experienced and motivated C/C++ (Linux) Software Engineer to join our team in Abu Dhabi, UAE. At least BSc in computer science.",None,None,2021-03-10
Echocardiographer,Abu Dhabi,NMC Royal Hospital KLF,None,"Escalate issues and concerns to engineer, supervisor, and/or cardiologist. 6 Provides images, data analysis, and patient information to the physician for…",None,None,2021-02-19
Electronics Technician,Abu Dhabi,JAMS HR Solutions,None,1.Set up electronic systems and devices 2.Assemble and connect system components 3.Build prototype models based on technical guidelines 4.Monitor and report on…,None,None,2021-03-09
Infrastructure Systems Engineer,Abu Dhabi,SUNDUS RECRUITMENT & OUTSOURCING SERVICES LLC,None,Introducing and integrating new technologies into the pre-existing environment data centre. Analyze system records and identify potential problems with computer…,None,None,2021-02-19
Account Manager,Abu Dhabi,Varonis,None,The Varonis Account Manager will be aligned with a local Sales Engineer. The Account Manager is responsible for selling and presenting Varonis’ products and…,None,None,2021-02-23
Civil QA/QC Engineer,Abu Dhabi,Al Ryum Group of Companies,None,"Devises sampling procedures and designs and develops forms and instructions for recording, evaluating, and reporting quality and reliability data.",None,None,2021-03-03
Senior Coastal Engineer,Abu Dhabi,NMDC,None,"Providing guidance, direction and briefing to the coastal engineers and graduates. Collect and/or purchase metocean data (hindcast, forecast, measurements) for…",Senior,None,2021-02-19
Linux Engineer,Abu Dhabi,Talent Boutique,None,"Responsible for sustainment support of all delivered mission-specific IT equipment (hardware and software), including customized and standalone IT equipment to…",None,None,2021-02-19
PMC Senior Construction Engineer - Electrical,Abu Dhabi,Wood Plc,None,"Carry out inspection, surveillance witnessing of contractor activities, ensuring records are maintained, including as-built data.",Senior,None,2021-02-26
Senior Site Inspector - Electrical & Telecom,Abu Dhabi,Parsons,None,Report back as necessary to the Resident Engineer and AREs. Issue instructions to the Engineer in Charge or Contractor’s representatives of the work.,Senior,None,2021-02-19
"Sr. Designer, Instrumentation and Automation",Abu Dhabi,Rejlers Finland & Abu Dhabi (UAE),None,"Ensure verification of source data, concept drawings/concepts as required. Rejlers International Engineering Solutions AB operates in Abu Dhabi, UAE, and…",Senior,None,2021-03-04
Senior Embedded/Firmware Engineer,Abu Dhabi,BeamTrail,None,"We are looking for an experienced Senior Firmware Engineer to join our team in Abu Dhabi, UAE. BeamTrail works towards delivering the best solutions and user…",Senior,None,2021-03-11
Senior Mechanical Design Engineer - Large Water Treatment Pu...,Abu Dhabi,AECOM,None,"+ Mentor Junior/Graduate Engineers to promote their technical and professional development. + Supervise, coordinate and support Engineer and provide design…",Senior,None,2021-02-19
Design Discipline Piping Engineer,Abu Dhabi,Rejlers Finland & Abu Dhabi (UAE),None,The Design Discipline Pip ing Engineer reports to the appointed manager. We are now looking for a Design Discipline Pip ing Engineer r to execute projects and…,None,None,2021-03-04
Android Engineer,Abu Dhabi,Anghami,None,Design data models and create database schemas using SQLite. We are looking for self-starting engineers with strong experience developing sophisticated…,None,None,2021-03-18
Network & Security Engineer,Abu Dhabi,Robert Half United Arab Emirates,None,Provide remote support to on-site engineers and end users during installation. Undertake capacity management and audit of IP addressing and hosted devices…,None,None,2021-03-05
Senior Design Manager,Abu Dhabi,AECOM,None,"+ Manage project data exchange websites where necessary. + Manages the assigned team of Architects, Engineers and Technicians on a day to day basis and ensures…",Senior,None,2021-02-19
Senior Infrastructure BIM Engineer,Abu Dhabi,iTech Management Consultancy and Training LLC,None,"Create job layout driven by 3D model data. Minimum 5 years project experience – Civil Engineer (transportation, water resources, land development, etc.).",Senior,None,2021-02-19
Senior Laboratory Technician,Abu Dhabi,Group 42,None,"Experienced team of data scientists and engineers based in Abu Dhabi. Fundamental AI research, through our subsidiary the Inception Institute of Artificial…",Senior,None,2021-02-19
Dredging Superintendent,Abu Dhabi,NMDC,None,"Ability to transform raw data ( CSV-files, loggings) into. Master or Civil Engineer in Construction, Mechanical, Marine Engineering.",None,None,2021-02-19
RF Board (Frontend) Design Engineer,Abu Dhabi,BeamTrail,None,"Work with vendors to develop custom RF components, system engineers, board designers and mechanical engineer to get the best RF performance.",None,None,2021-02-19
Senior Reservoir Engineer,Abu Dhabi,WTS Energy,None,"§ Complete reservoir evaluation using logs, core, pressure transient data; The Senior Reservoir Engineer is given general objectives, proceeds on own initiative…",Senior,None,2021-02-19
Senior Software Engineer – C/C++,Abu Dhabi,BeamTrail,None,"We are looking for an experienced, motivated and well-rounded Senior Software Engineer to join us in Abu Dhabi. At least BSc in computer science.",Senior,None,2021-03-11
ELECTRICAL PLANNER,Abu Dhabi,Profile Middle East,None,May be required to undertake Competency Based test witnessed by the COMPANY Discipline Engineer. Must be able to read Electrical related technical documentation…,None,None,2021-02-19
BIM Technician (Bridges). - Abu Dhabi,Abu Dhabi,AECOM,None,+ May perform some data entry. The Design Technician will be responsible to coordinate with the Bridge Design Engineer and produce the Bridge Design drawings in…,None,None,2021-02-19
Senior Petrophysicist,Abu Dhabi,IDCMPS,None,Designs and proposes formation evaluation programs using open and cased hole logging technology to optimize data acquisition strategy.,Senior,None,2021-02-19
Control & Systems Technician,Abu Dhabi,WTS Energy,None,"Update the equipment data, history and maintenance records in ‘CMMS’ system for timely availability of up to date information.",None,None,2021-03-08
LIMS Application Engineers - IT Healthcare Project,Abu Dhabi,Marc Ellis Consulting,None,"Instrument interface, API, DevOps, Data flow, LIMS (Laboratory Information Management Systems). We're seeking LIMS Application Engineers to add value within IT…",None,None,2021-03-14
Software Architect (Development Team Leader),Abu Dhabi,Independent Health Information Technology Services,None,"Provide supporting information to the Engineers to aid in the creation of a system specification. As Software Architect, you will lead the design effort on a…",Architect,None,2021-02-19
Sr. Smart Plant P&ID Administrator,Abu Dhabi,Rejlers Finland & Abu Dhabi (UAE),None,"Maintain the SPPID reference database for projects including transfer, reports, MTO downloads, data integrity, etc. including the customization of reports as…",Senior,None,2021-03-04
