Title,Location,Company,Salary,Synopsis,Level,Experience,Date Posted
Sr. Smart Plant Foundation Administrator,Abu Dhabi,Rejlers Finland & Abu Dhabi (UAE),None,Work with remote execution centers to ensure data integrity and productivity of activities. Training to Engineers for Smart Plant desktop client and the web…,Senior,None,2021-03-04
Senior Hardware Systems Engineer (RF),Abu Dhabi,BeamTrail,None,"A minimum of 7 years’ work experience as system engineer. Our growing R&D team in Abu Dhabi, UAE are looking for a Senior Hardware Systems Engineer to join us…",Senior,None,2021-03-11
Lead SOC Developer,Abu Dhabi,Digital14,None,Ability to communicate and articulate crisply at all levels from executive staff to engineers. Their responsibility will be to integrating security systems in…,None,None,2021-02-19
Sr. Smart Plant Instrumentation Administrator,Abu Dhabi,Rejlers Finland & Abu Dhabi (UAE),None,"Support engineers, designers in engineering. Provides efficient data imports and exports. Develops training plans for engineers, designers, and technicians as…",Senior,None,2021-03-04
Automation Developer,Abu Dhabi,Group 42,None,"Experienced team of data scientists and engineers based in Abu Dhabi. Fundamental AI research, through our subsidiary the Inception Institute of Artificial…",None,None,2021-02-19
Senior Engineering Program Engineer,Abu Dhabi,Nawah Energy Company,None,Develop software tools as required to support engineering programs and verify the input baseline data in the related database to ensure data security and…,Senior,None,2021-02-19
Senior Geotechnical Design Engineer,Abu Dhabi,NMDC,None,"Analyze geotechnical findings, perform appropriate calculations and prepare data reports to Manager. Analyze the geotechnical data and prepare of geotechnical…",Senior,None,2021-02-19
​Technical Lead II Mechanical Maintenance,Abu Dhabi,K&K Selekt,None,Sending personal data to a wider extent than specified in art. I also agree to share my personal data with potential employers for purposes related to the…,None,None,2021-02-19
Senior HPC Cluster Sytm. Eng.,Al-Ayn,United Arab Emirates University,None,"HPC cluster systems engineer is responsible for managing and supporting all HPC systems and Grid system, for the University data center and distributed…",Senior,None,2021-02-19
Senior Development Manager,Abu Dhabi,Digital14,None,"Recruit great engineers in collaboration with recruiting team. Strong knowledge of data structures, concurrency, modern design patterns, object-oriented…",Senior,None,2021-02-19
Senior HVDC Cable Engineer,Abu Dhabi,SNC-Lavalin,None,Eligibility for registration with a Professional Order of Engineers. Cable Engineer will also be called upon to work on High Voltage AC cables.,Senior,None,2021-03-02
Senior Landscape Architect (Short Term Assignment),Abu Dhabi,Stantec,None,"Have sense of defining technical problems, collect appropriate and related data to establish solutions / results. Attend client meetings and in-house meetings.",Senior,None,2021-02-19
"Designer/Draftsman, Electrical",Abu Dhabi,Rejlers Finland & Abu Dhabi (UAE),None,"Ensure verification of source data, concept drawings/concepts as required. Rejlers International Engineering Solutions AB operates in Abu Dhabi, UAE, and…",None,None,2021-03-04
Sr. Smart Plant 3D Administrator,Abu Dhabi,Rejlers Finland & Abu Dhabi (UAE),None,"Set-up and maintain reference database for SP3D by Smart plant Reference Data. Co-ordinate and /or negotiate with clients, vendors, and other discipline…",Senior,None,2021-03-04
Security System Engineer - PSIM Engineer,Abu Dhabi,CC Staffing International,None,Analyze a large volume of data and find solutions for problems. Assisting in implementing and maintaining a Physical Security Information Management (PSIM)…,None,None,2021-02-19
Sr. Discipline Piping Designer,Abu Dhabi,Rejlers Finland & Abu Dhabi (UAE),None,Act as senior and interact with the Design Discipline Piping Engineer and the project manager for solving technical problems arising during project development.,Senior,None,2021-03-04
"Designer/Draftsman, Instrumentation and Automation",Abu Dhabi,Rejlers Finland & Abu Dhabi (UAE),None,"Ensure verification of source data, concept drawings/concepts as required. Rejlers International Engineering Solutions AB operates in Abu Dhabi, UAE, and…",None,None,2021-03-04
Estimation Engineer,Ajman,ZIQAR TECHNICAL WORKS LLC,"2,000-2,100",Input cost data into company database. An estimator is responsible for attempting to figure out how much a project will cost.,None,None,2021-03-19
Estimation Engineer,Ajman,MIACASA STEEL INDUSTRIES LLC,None,"Build relationships with key vendors (subcontractors, suppliers, engineers etc.). In depth knowledge of research and data analysis methods and estimation…",None,None,2021-02-25
Technical Sales Engineer,Ajman,ISCS,"5,000-9,000","Work closely with Technical Service department to develop performance data, solve customers’ formulating problems and provide technical assistance to customers.",None,1,2021-02-19
Proposal & Process Engineer for Sharjah,Sharjah,Lime Souring (Recruitment) Services,"6,000-8,000","Process design, proposal engineer, water / wastewater. Build relationships with key vendors (subcontractors, suppliers, engineers etc.).",None,5,2021-03-18
JUNIOR PROJECT ENGINEER,Sharjah,Sharjah Oxygen Company,None,"Good record keeping and data organizational skills. An engineering graduate in industrial, mechanical and chemical field.",Junior,None,2021-02-19
Project Engineer - Sharjah,Sharjah,Subsea 7,None,Assist and guide graduates/junior engineers. These are to be passed to the Senior Project Engineer & where agreed with the client included on the DPR.,None,None,2021-03-01
IT Desktop Support Engineer,Sharjah,Axiom Technologies,None,Weighs up options using the available data. Relates and compares data from different sources. Seeks out and uses factual data when available.,None,None,2021-03-04
Senior Project Engineer,Sharjah,Crescent Petroleum,None,"Provides specification interpretation, technical guidance, and engineering support for various projects to Senior Engineers and/or Project Managers.",Senior,None,2021-02-19
Application Engineer,Sharjah,SKM Air Conditioning LLC,None,"Responsible for preparation of Selections and Technical Data as and when required. Responsible for responding to technical inquiries from consultants, MEP…",None,2,2021-03-02
Siebel Software Engineer,Sharjah,IRESCO,"2,391-10,433","Hands on experience on Siebel configuration (UI Layer, BO Layer and Data object layer). Post graduate in Computer Science or related field (or equivalent…",None,None,2021-03-08
IT Engineer - Male,Sharjah,M.Gheewala Global HR Consultants,None,"IT Engineer (Male) • .Net Developer designs modifies, develops, writes and implements software programming applications and components.",None,None,2021-02-19
Petrophysicist,Sharjah,Crescent Petroleum,None,"Assist in the planning of data collection programs (core and log data). Work closely with petrophysics supervisor, other geoscientists, and reservoir engineers…",None,None,2021-02-19
MEP Business Development Engineer,Sharjah,Asia Prime General Contracting Company,None,"OCollecting data for each project including consultant, contractors, competitors, and end-user. OSearch for new clients who could benefit from our products and…",None,None,2021-03-16
Battery Shop Technician,Sharjah,Air Arabia PJSC (G9),None,Performs defect troubleshooting and rectification in accordance with approved data and instructions provided by Engineering Department.,None,None,2021-03-08
Performance Engineer,Sharjah,Air Arabia PJSC (G9),None,7+ years of experience in a comparable airlines or aircraft manufacturer company in the operations/engineering department as an approved or licensed Engineer/…,None,None,2021-02-19
Senior Development Geologist,Sharjah,Crescent Petroleum,None,"Responsible for geological database, data management and quality control and related to field geological data and seismic data.",Senior,None,2021-02-19
Senior Full Stack Engineer,Sharjah,Crescent Petroleum,None,"Implementation of security and data protection. Good understanding of OOP, FP, design patterns, data structures. Good understanding of building REST APIs.",Senior,None,2021-02-19
WAREHOUSE/MATERIAL ENGINEER,Sharjah,Profile Middle East,None,Ensure the vendor Manufactured Data Book review and approval. Guarantee exhaustive and punctual data updating in SAP and support and validate any vendor…,None,None,2021-02-19
Electronic Technician,Sharjah,JAMS HR Solutions,None,1.Set up electronic systems and devices 2.Assemble and connect system components 3.Build prototype models based on technical guidelines 4.Monitor and report on…,None,None,2021-03-07
Enterprise Architect,Sharjah,Mbr Headhunters,None,"Proven skills in analyzing data, identifying pitfalls and recommending cost-effective solutions. Deep experience in at least two, and documented experience in…",Architect,None,2021-02-19
QA/QC Engineer,Ras al-Khaimah,UNION GROUP,None,We are currently looking for QA/QC Engineer. Mechanical Engineer candidates with 3-5 years of experience who are available locally can apply.,None,None,2021-02-24
"Static Equipment Design Engineer ( Vessels ,Heat Exchanger e...",Ras al-Khaimah,Berg Industries LLC.,"6,000-7,000","Preparation of data sheet (pumps, valves) as per project specification. Preparation of 3D Modeling, pipe stress analysis perform in CAESAR II & design…",None,4,2021-03-02
Technical Sales Engineer,Ras al-Khaimah,ISCS,"5,000-9,000","Work closely with Technical Service department to develop performance data, solve customers’ formulating problems and provide technical assistance to customers.",None,1,2021-02-19
Engineering Manager,Ras al-Khaimah,JAMS HR Solutions,None,"Advance planning/tracking of paperwork, resources, customer responsibilities, data submittals. Engineers to design & deliver solutions for Power Skids, Acoustic…",None,None,2021-03-07
Construction Manager (Earthworks),Ras al-Khaimah,Big Fish Recruitment,None,Review inspection and test data for compliance with specifications; Bachelors Degree in Civil Engineer • At least 10 years experience in Construction project…,None,None,2021-02-19
Assistant/Associate Professor of Computer Science,Ras al-Khaimah,American University of Ras Al Khaimah,None,"Knowledge of data science, artificial intelligence, and games design is a plus. Computer Science, Computer Engineering, and Artifcial Intelligence & Data…",None,None,2021-02-19
Network Support Engineer,None,FOMI technologies LLC,"5,000-9,000","O Maintain data center environmental and monitoring equipment. O Perform daily backup operations, ensuring all required file systems and system data are…",None,5,2021-02-19
"Security Engineer, Pre-Sales, UAE",Ras al-Khaimah,Vectra,None,3+ years experience in technical or pre-sales support as a Security Engineer (or Sales Engineer). Collaborate with other Vectra Engineers on high-level projects…,None,None,2021-02-19
