Title,Location,Company,Salary,Synopsis,Level,Experience,Date Posted
Operations Intern,Dubai,Pyypl Ltd.,None,Who will support the Growth Operations Manager. We are a family of very experienced digital experts. Distribute sales and marketing materials to internal and…,None,None,3/15/21
"Business Development Manager (Appliances, HVAC & Lighting)",Dubai,Underwriters Laboratories Inc.,None,"Works closely with Marketing and Product Management to develop competitive analyses and market trend insights. At UL, we know why we come to work.:",None,None,3/14/21
Business Development Manager,Dubai,VOUS,None,We are a Creative Digital Marketing Agency focused on growing brands online. Business Development Manager responsibilities are:,None,None,3/8/21
Enterprise Account Manager - Public Sector,Dubai,unifonic,None,"Establish and maintain sound and lasting customer relationships with IT, Marketing, Strategy, HR, Sales, Digital Transformation, and procurement.",None,None,3/17/21
Business Development Manager,Dubai,CRMNEXT,None,"For the business development manager, the target sector will be Banking and Financial industry with B2B Sales. UG:Any Graduate in Any Specialization.",None,None,3/10/21
Manager for Marketing,Dubai,Al Nile Centre,"6,000-8,000",We are looking for a Marketing Manager who will be best fit for the below Duties & Responsibilities: Proven experience developing marketing plans and campaigns.,None,3,3/4/21
"Consulting, Financial Services - Customer Practice - Manager",Dubai,PwC,None,"Customer value management, segmentation, pricing, product development, customer and business strategy, marketing and sales effectiveness etc.",None,None,2/20/21
Ecommerce Manager,Dubai,Middle East Executive,None,"This role will be working with a well known eCommerce consultancy to develop the strategy, develop the performance of the site and manage the digital marketing,…",None,None,2/20/21
Content Manager,Dubai,Alpha Italia,None,"The content manager should have a strong passion for this industry. Create, develop and manage content for organization’s Digital presence (requires working…",None,None,2/20/21
Digital Content Producer,Dubai,Blue Book Global,None,A leading digital agency working with renowned brands are seeking an Arabic speaking Digital Content Producer to join their team. Must be fluent in Arabic.,None,None,2/20/21
Sales Bus Dev Assoc Manager,Dubai,PepsiCo,None,"Experience of 1-2 Years in Key account Manager / Trade Marketing / Insights. Lead coordination between Sales, Marketing, BU Inisghts team to create, develop &…",None,None,2/26/21
Client Services Manager,Dubai,JAMS HR Solutions,None,"5+ years of experience in managing digital or mobile or online campaigns, servicing clients, sales planning and marketing position in either Telecoms, Music or…",None,None,3/7/21
Vendor Manager for Electronics,Dubai,SIGNATURE TECHNOLOGY DMCC,None,Bachelor’s degree or master’s degree in marketing or business administration. The Vendor Manager must be an effective leader and communicator in working with…,None,5,2/20/21
Digital Marketing Manager,Abu Dhabi,"P ONE GROUP / Madinat Zayed – Abu Dhabi, (Western...","2,500-3,500",Proven experience as Digital Marketing Executive or similar role. Excellent understanding of digital marketing concepts and best practices.,None,None,3/22/21
Digital Marketing Manager,Abu Dhabi,Al Ikhlas Gen Trading,"6,000-7,000",Digital Marketing Manager Job Descriptions: At least two years' experience as a marketing manager. We are seeking an innovative marketing manager to promote our…,None,5,3/11/21
Digital Manager,Abu Dhabi,Farah Experiences,None,Proven understanding of digital marketing principles. 3-5 years of accomplished digital marketing experience within e-commerce / entertainment sectors.,None,None,3/3/21
Marketing and Digital Executive,Abu Dhabi,International Gas Services Est,None,"SEO, SEM/PPC, Email Marketing Campaigns, Digital Campaigns, Web Banner Advertising, Website and Applications Marketing, Supervision of UI/UX design of websites…",None,-2,3/19/21
Marketing Manager- Jumeirah at Saadiyat Island Resort,Abu Dhabi,Jumeirah,None,Marketing Manager- Jumeirah at Saadiyat Island Resort - (2100001L). Through the marketing and comms strategy optimal utilization of digital channels and the…,None,None,2/20/21
Sales Manager Foodservice Abu Dhabi,Abu Dhabi,INDOGUNA DUBAI LLC,"12,000-15,000","A Bachelor’s degree in Marketing, Business Adminisration or related fields. Minimum 3 years of experience of Sales, Marketing and Communication Management,…",None,None,2/20/21
Marketing Engagement Executive,Abu Dhabi,Property Shop Investment,None,"Knowledge of traditional and digital marketing, content marketing, and social media marketing. Knowledge of traditional and digital marketing, content marketing…",None,None,3/18/21
Assistant Marketing Manager - Automotive,Abu Dhabi,TGC Consulting Middle East,None,"As an Assistant Marketing Manager, you will be responsible for implementing and managing retail campaigns and B2B channels covering the company’s automobile key…",None,None,3/4/21
Design Manager,Abu Dhabi,AECOM,None,+ Contribute to marketing and business development. + The Design Manager will always be expected to convey a positive attitude whilst maintaining the highest…,None,None,2/20/21
Named Account Manager - Gulf,Abu Dhabi,Palo Alto Networks,None,"The Named Account Manager is a significant driver of company revenue and growth. Being the cybersecurity partner of choice, protecting our digital way of life.",None,None,3/10/21
Digital & Social Media Specialist for Advertising and Media...,Al-Ayn,Pioneer Vision Group,"5,000-7,000","Minimum of 3 years’ experience as a Digital marketing specialist or manager • BSc degree in Marketing, Digital Media or relevant field • Familiar with email…",None,3,2/24/21
Marketing & Communications Coordinator Internship (Minimum S...,Abu Dhabi,Alpin Limited,None,"Research and evaluate competitor marketing and digital content; Knowledge of digital marketing techniques such as SEA, SEO, web design and analytics, email…",None,None,2/20/21
Marketing & Communications Internship,Abu Dhabi,Alpin Limited,None,Research and evaluate competitor marketing and digital content; Solid understanding of different marketing techniques; This role is for the UAE.,None,None,2/20/21
Senior Design Manager,Abu Dhabi,AECOM,None,+ Engage in marketing and business development. + The Senior Design Manager will be expected to convey a positive attitude whilst maintaining the highest…,Senior,None,2/20/21
Office Marketing Assistant,Abu Dhabi,Black Pearl Consult,None,Support Marketing Manager on delivering sponsor benefits as per the agreements. Support marketing manager with internal presentations and coordinate with…,None,None,2/20/21
CHANNEL & FIELD MARKETING LEADER-META,Abu Dhabi,Rockwell Automation,None,"Modern and integrated marketing experience. He or she will act as liaisons between the different marketing functions, global or regional, marketing or sales.",None,None,2/20/21
Social Media Intern/Coordinator,Al-Ayn,Global Corp Group (Food & Beverages),"2,500-3,500","Provide a weekly report on the client competitors marketing efforts, from social media, digital marketing, PR, media production and marketing campaigns, and…",None,1,3/3/21
Business Development Manager-with Driving License,Abu Dhabi,Mobishastra Technologies,"2,500-4,000","Sales of Digital marketing package,. Online and Print AD space selling packages,.",None,1,3/9/21
Assistant Director of Marketing,Abu Dhabi,"Marriott International, Inc",None,Hospitality marketing or digital advertising experience preferred. Hospitality marketing or digital advertising agency experience preferred.,None,None,3/12/21
Social Media Manager - Arabic Speaker,Abu Dhabi,Black Pearl Consult,None,This position will work closely with the Digital Marketing & Ecommerce Manager on managing spend and schedules. Must have experience in account management.,None,None,3/2/21
Creative Director,Abu Dhabi,Black Pearl Consult,None,"Serve as project manager of the organization; Coordinates efforts by establishing procurement, production, marketing, field, and technical services policies and…",None,None,3/2/21
Marketing Executive (Arabic Speaker),Abu Dhabi,Black Pearl Consult,None,Support Marketing Manager on delivering sponsor benefits as per the agreements. Support marketing manager with internal presentations and coordinate with…,None,None,2/20/21
Digital Marketing Executive,Al-Ayn,Royal Sky,None,"Planning digital marketing campaigns, including web, SEO/SEM, email, social media, and display advertising • Developing and optimizing marketing campaigns (no…",None,None,2/20/21
Social Media Manager Internship,Abu Dhabi,JAMO Magazine,None,"JAMO Magazine is the UAE's first digital Young Publication (E-Magazine) based in Abu Dhabi. We are looking for young talented and freshly graduate, motivated…",None,1,2/20/21
Marketing Manager,Al-Ayn,Royal Sky,None,Min 6 years experience as Marketing Manager. Develop and implement of the Brand and marketing strategy for new and existing Services to achieve company Goals -…,None,None,2/20/21
Marketing Executive,None,Alsahil facilities management services LLC,"3,300","Collaborating with the marketing manager, internal teams, clients and partners on marketing strategy. Learning and working with various types of software for…",None,None,3/12/21
Marketing Executive,Ajman,Alsahil facilities management services LLC,"3,300","Collaborating with the marketing manager, internal teams, clients and partners on marketing strategy. Learning and working with various types of software for…",None,None,3/12/21
Social Media Marketing,None,Abdulaziz Mohd Al Majid EST,None,Proven work experience as a Digital media specialist or Digital marketing manager. You will lead our marketing efforts using new media and digital tools.,None,1,3/17/21
Digital Marketing Specialist,None,car center services,"3,500-4,500","Proven work experience as a Digital media specialist or Digital marketing manager. BSc degree in Marketing, Digital media or relevant field.",None,None,2/20/21
Communication Manager,Sharjah,Veolia,None,"Work closely with the Middle East Marketing Manager for the content creation/update, event management and any communication (including digital communication).",None,None,3/18/21
Social Media Marketing,Sharjah,Abdulaziz Mohd Al Majid EST,None,Proven work experience as a Digital media specialist or Digital marketing manager. You will lead our marketing efforts using new media and digital tools.,None,1,3/17/21
"RC RAK, Al Wadi Desert - Marketing Coordinator",Ras al-Khaimah,"Marriott International, Inc",None,"Provide on-property support to a variety of positions and/or areas (i.e., Field Marketing, Field Ecommerce and Market Associate Director of Public Relations &…",None,None,2/20/21